{
  "schema_version": 2,
  "model_id": "elevenlabs/eleven-v3",
  "provider": "elevenlabs",
  "api_model": "eleven_v3",
  "display_name": "ElevenLabs Eleven v3",
  "kinds": [
    "Voice",
    "VoiceClone"
  ],
  "model_guide": "# ElevenLabs Eleven v3 — Guide d'utilisation\n\n## Capacités\n\n- Text-to-Speech haute qualité (Elo 1178, #4 Artificial Analysis)\n- Voice cloning instantané depuis un échantillon audio\n- 70+ langues supportées\n- 380+ voix prédéfinies dans la bibliothèque communautaire\n- Contrôle émotionnel via tags (v3)\n- Sortie audio 44.1kHz / 192kbps\n\n## Paramètres clés\n\n| Paramètre | Type | Default | Description |\n|-----------|------|---------|-------------|\n| text | string | requis | Texte à synthétiser |\n| model_id | enum | eleven_v3 | Modèle à utiliser |\n| voice_id | string | requis | ID de la voix |\n| stability | float | 0.5 | Stabilité (0-1) |\n| similarity_boost | float | 0.75 | Similarité voice clone (0-1) |\n| style | float | 0 | Expressivité (0-1) |\n| use_speaker_boost | bool | true | Boost qualité |\n\n## Bonnes pratiques\n\n- Utilisez des phrases courtes pour une meilleure prosodie\n- Pour le dialogue, séparez les répliques avec des sauts de ligne\n- Le voice cloning nécessite 5-15 secondes d'audio propre\n- Utilisez `stability` plus bas pour plus d'expressivité",
  "parameters": {
    "text": {
      "type": "string",
      "default": "",
      "required": true,
      "description": "Texte à synthétiser en voix"
    },
    "model_id": {
      "type": "enum",
      "default": "eleven_v3",
      "allowed": ["eleven_v3", "eleven_multilingual_v2", "eleven_turbo_v2_5", "eleven_flash_v2_5"],
      "required": true,
      "description": "Modèle ElevenLabs"
    },
    "voice_id": {
      "type": "string",
      "default": "21m00Tcm4TlvDq8ikWAM",
      "required": true,
      "description": "ID de la voix (défaut: Rachel)"
    },
    "stability": {
      "type": "number",
      "default": 0.5,
      "required": false,
      "description": "Stabilité de la voix (0-1)"
    },
    "similarity_boost": {
      "type": "number",
      "default": 0.75,
      "required": false,
      "description": "Boost de similarité pour voice clone (0-1)"
    },
    "style": {
      "type": "number",
      "default": 0,
      "required": false,
      "description": "Niveau d'expressivité (0-1)"
    },
    "output_format": {
      "type": "enum",
      "default": "mp3_44100_192",
      "allowed": ["mp3_44100_128", "mp3_44100_192", "pcm_16000", "pcm_22050", "pcm_24000", "pcm_44100"],
      "required": false,
      "description": "Format de sortie audio"
    }
  }
}